{
  "$schema": "../schemas/simple-workbook.schema.json",
  "schemaVersion": 1,
  "id": "circle",
  "label": "מעגל",
  "pageCount": 88,
  "sourceType": "numbered-html-series",
  "folder": "circle",
  "pagePattern": "page-{page}.html",
  "pageRange": { "start": 1, "end": 88 },
  "identity": { "nameField": false, "dateField": false },
  "a4UtilizationMaxBlankPx": 150
}
